Advancements in instrument construction, and new compositional techniques resulted in a new kind of music called;Absolute, or pure music;
Chamber music can be defined as:;A and B;
The main idea for a rondo or ritornello is that:;The A theme recurs between each contrasting section;
In Haydn’s Symphony No. 94 at time mark 1:07, which group of instruments are playing the theme? [song id = 20197666];Low strings;
In Haydn’s Symphony No. 94 at time mark 2:13, what mode is the theme in? [song id = 20197666];Minor;
A work with four movements is a;Symphony;
In a Theme and Variation the composer will write;A basic melody for the theme then embellish the same melody in different ways for each variation;
A work with three movements is a;Concerto;
Form can be defined as:;Recognized patterns of contrast and repetition for composers;
A work with three movements is a;Sonata;
A work with four movements is a;String Quartet;
What is a virtuoso?;An instrumental musician who has reached the highest levels of proficiency on their instrument;
What are the names of the 3 main sections of Sonata-allegro form?;Exposition, Development, Recapitulation;
Beethoven’s famous letter to his brothers, in which he speaks of his loneliness, his ailment, and other frustrations in his life, is called:;The Heiligenstadt testament;
Composer Franz Joseph Haydn made a living for most of his life by doing what?;Serving as Kappelmeister for the Esterhazy family in Hungary;
In which form is the 3rd movement of Beethoven’s Moonlight Sonata written? [song id = 13878043];Sonata-allegro;
Which instrument has 2 or more ranks of keys, pedals, stops, and pipes?;The organ;
Listen to the Little Fugue in g minor, starting at 0:45. What part of the organ is playing the Subject? [song id = 2199669];The pedals;
Which of the following statements is NOT true of Haydn?;All of the above are true;
How did J.S. Bach make a living?;By serving as an organist and kappelmeister to German nobility;
Johann Sebastian Bach came from a family of musicians.;True;
Which of the following is a solo piece for an instrument?;A and B only;
Listen to the Little Fugue in g minor, starting at 2:22. What part of the fugue do you hear?   Listen to the song below. [song id = 2199669];Subjects I and II;
The 3rd movement of Beethoven’s Moonlight Sonata does NOT have a coda.;False;
Which form does the 3rd movement of Haydn’s Concerto in E-flat for Trumpet and Orchestra use? [song id = 8693081];Rondo;
Listen to the Little Fugue in g minor starting from the beginning. What happens at 0:14?   Listen to the song below. [song id = 2199669];Subject II enters;
Ludwig von Beethoven was raised by two, loving and well-balanced parents.;False;
In movement I of Beethoven’s Moonlight Sonata, what figure do we hear at the very beginning? [song id = 13878038];A triplet ostinato figure;
True or False: A fugue is a contrapuntal composition.;True;
In which way(s) are a sonata and concerto different?;A and C only;
Listen to the 1st movement of Beethoven’s Moonlight Sonata from 2:56 – 3:49. Which section of the movement is this?  Listen to the song below. [song id = 13878038];B;
Beethoven suffered from which ailment?;Deafness;
Listen to the 3rd movement of Beethoven’s Moonlight Sonata, beginning at 3:04. Which major section of the form begins here?   Listen to the song below. [song id = 13878043];Development;
Beethoven’s professional life is divided into how many periods?;3;
Identify the time mark in which the Recapitulation occurs: [song id = 15121211];4:15;
In the third movement which instruments first state the “Fate” theme from the first movement? [song id = 28949340];horns;
The word “symphony” refers to;A large work written for orchestra consisting usually of four individual movements;
The famous “fate” motif that opens Beethoven’s Fifth Symphony is comprised of which rhythmic grouping? [ song id = 15121211 ];Three short notes and one long note;
Identify the correct composer, title and movement number from this example: [song id = 15121223];Symphony No. 5, mvt iii, Beethoven;
The first movement of a symphony is usually written in which form?;Sonata (ABA’) form;
The number of instruments in an orchestra has _________ since the Classical period.;Grown in size;
There is a segue from the third movement to the fourth movement of Beethoven’s Fifth Symphony. Segue means:;to continue to the next movement without a break;
In sonata form, the three sections are called:;Exposition, Development, Recapitulation;
Identify the correct composer, title and movement number from this example: [song id = 15121211];Symphony No. 5, mvt. I, Beethoven;
Theme II of the first movement of Beethoven’s Fifth Symphony is in the relative major key, rather than the dominant key. Listen to the clip and identify where the Theme II in a major key begins: [song id = 15121211];0:46;
The “fate” motif from the first movement;Appears in each of the successive movements, tying the symphony together.;
Identify the section of the first movement of Beethoven’s Fifth Symphony in this example: [song id = 15121211];Exposition;