Advancements in instrument construction, and new compositional techniques resulted in a new kind of music called;Absolute, or pure music;
Chamber music can be defined as:;A and B;
The main idea for a rondo or ritornello is that:;The A theme recurs between each contrasting section;
In Haydn’s Symphony No. 94 at time mark 1:07, which group of instruments are playing the theme? [song id = 20197666];Low strings;
In Haydn’s Symphony No. 94 at time mark 2:13, what mode is the theme in? [song id = 20197666];Minor;
A work with four movements is a;Symphony;
In a Theme and Variation the composer will write;A basic melody for the theme then embellish the same melody in different ways for each variation;
A work with three movements is a;Concerto;
Form can be defined as:;Recognized patterns of contrast and repetition for composers;
A work with three movements is a;Sonata;
A work with four movements is a;String Quartet;
What is a virtuoso?;An instrumental musician who has reached the highest levels of proficiency on their instrument;
What are the names of the 3 main sections of Sonata-allegro form?;Exposition, Development, Recapitulation;
Beethoven’s famous letter to his brothers, in which he speaks of his loneliness, his ailment, and other frustrations in his life, is called:;The Heiligenstadt testament;
Composer Franz Joseph Haydn made a living for most of his life by doing what?;Serving as Kappelmeister for the Esterhazy family in Hungary;
In which form is the 3rd movement of Beethoven’s Moonlight Sonata written? [song id = 13878043];Sonata-allegro;
Which instrument has 2 or more ranks of keys, pedals, stops, and pipes?;The organ;
Listen to the Little Fugue in g minor, starting at 0:45. What part of the organ is playing the Subject? [song id = 2199669];The pedals;
Which of the following statements is NOT true of Haydn?;All of the above are true;
How did J.S. Bach make a living?;By serving as an organist and kappelmeister to German nobility;
Johann Sebastian Bach came from a family of musicians.;True;
Which of the following is a solo piece for an instrument?;A and B only;
Listen to the Little Fugue in g minor, starting at 2:22. What part of the fugue do you hear?   Listen to the song below. [song id = 2199669];Subjects I and II;
The 3rd movement of Beethoven’s Moonlight Sonata does NOT have a coda.;False;
Which form does the 3rd movement of Haydn’s Concerto in E-flat for Trumpet and Orchestra use? [song id = 8693081];Rondo;
Listen to the Little Fugue in g minor starting from the beginning. What happens at 0:14?   Listen to the song below. [song id = 2199669];Subject II enters;
Ludwig von Beethoven was raised by two, loving and well-balanced parents.;False;
In movement I of Beethoven’s Moonlight Sonata, what figure do we hear at the very beginning? [song id = 13878038];A triplet ostinato figure;
True or False: A fugue is a contrapuntal composition.;True;
In which way(s) are a sonata and concerto different?;A and C only;
Listen to the 1st movement of Beethoven’s Moonlight Sonata from 2:56 – 3:49. Which section of the movement is this?  Listen to the song below. [song id = 13878038];B;
Beethoven suffered from which ailment?;Deafness;
Listen to the 3rd movement of Beethoven’s Moonlight Sonata, beginning at 3:04. Which major section of the form begins here?   Listen to the song below. [song id = 13878043];Development;
Beethoven’s professional life is divided into how many periods?;3;
Identify the time mark in which the Recapitulation occurs: [song id = 15121211];4:15;
In the third movement which instruments first state the “Fate” theme from the first movement? [song id = 28949340];horns;
The word “symphony” refers to;A large work written for orchestra consisting usually of four individual movements;
The famous “fate” motif that opens Beethoven’s Fifth Symphony is comprised of which rhythmic grouping? [ song id = 15121211 ];Three short notes and one long note;
Identify the correct composer, title and movement number from this example: [song id = 15121223];Symphony No. 5, mvt iii, Beethoven;
The first movement of a symphony is usually written in which form?;Sonata (ABA’) form;
The number of instruments in an orchestra has _________ since the Classical period.;Grown in size;
There is a segue from the third movement to the fourth movement of Beethoven’s Fifth Symphony. Segue means:;to continue to the next movement without a break;
In sonata form, the three sections are called:;Exposition, Development, Recapitulation;
Identify the correct composer, title and movement number from this example: [song id = 15121211];Symphony No. 5, mvt. I, Beethoven;
Theme II of the first movement of Beethoven’s Fifth Symphony is in the relative major key, rather than the dominant key. Listen to the clip and identify where the Theme II in a major key begins: [song id = 15121211];0:46;
The “fate” motif from the first movement;Appears in each of the successive movements, tying the symphony together.;
Identify the section of the first movement of Beethoven’s Fifth Symphony in this example: [song id = 15121211];Exposition;
John Adams’ piece Short Ride on a Fast Machine is an example of;Minimalism;
In Short Ride on a Fast Machine the woodwind flourishes seem to evoke a visual image of;Spinning wheels;
The compositional technique for playing all twelve notes in a chromatic scale in a predetermined order is called:;Serialism;
Listen to Prelude from time mark 4:19 to 5:50. The main theme is passed from: [song id = 3131286];Woodwinds to strings;
Impressionist composers experimented with;All of the above;
John Cage wrote music for ____________ piano.;Prepared;
In the Theme of the Variations for Orchestra Op. 31 by Arnold Schoenberg, which instrument introduces three of the four rows?;Cello;
The composer who felt German chromaticism had taken tonality as far as it could go was;Arnold Shoenberg;
When the sounds in a composition are left to chance we call this type of music;Indeterminant;
Start Prelude to the Afternoon of a Faun at time mark 3:15. Which instrument plays this theme? Listen to the song below. [song id = 3131286];Oboe;
At time mark 1:48 in Short Ride, the setting of a triple rhythm against a duple rhythm is called Listen to the song below. [song id = 21136061];Hemiola;
Following Beethoven, classical music became increasingly;Dissonant;
The first composers to make a serious break from the chromaticism of the German Romantics were the Impressionists of:;France;
A landmark piece of Indeterminate music is titled:;4’33”;
Atonal music is music that lacks;Tonality or a tone center;
Claude Debussy’s Prelude on the Afternoon of a Faun can be partitioned into which three sections?;A B A’;
Jazz has its roots in which musical genres:;All of the above;
“Bebop”, which was a reaction to swing, was an attempt to bring jazz;Back to its improvisatory roots;
Jazz has its roots in the Southern U.S. city of;New Orleans, LA;
In the first 1:30 of St. Louis Blues, when does the harmony move to the subdominant (IV)? [song id = 11675090];0:19;
After World War II, jazz, swing, and bebop evolved into a style called;Rhythm and Blues;
Bebop was pioneered by;"Dizzy” Gillespie and Charlie Parker;
Edward Kennedy “Duke” Ellington experimented with sonority to develop a style within jazz called;Big Band;
True or False In Jazz the “on-beats” are emphasized over the “off-beats”;False;
At the beginning of Donna Lee the piano plays chords in the background to accentuate the harmony of the composition. This technique is called [song id = 3891521];Comping;
In jazz, the beat is “swung.” “Swinging” means to;Divide the beat unequally into 2/3 and 1/3 halves;
At time mark 1:18 Louis Armstrong improvises using what method? Listen to the song below. [song id = 20992410];Skat singing;
Which musician was at the forefront of Dixieland music?;Louis Armstrong;
The main melody in a piece of jazz is referred to as:;The head;
At time mark 1:32 in St. Louis Blues, which mode does the harmony shift to? Listen to the song below. [song id = 11675090];Minor;
Time mark 2:04 in "It Don’t Mean a Thing if It Ain’t Got That Swing", the saxophones have a soli section which means: Listen to the song below. [song id = 16833083];All the saxophones play a solo together;
In It Don’t Mean a Thing if It Ain’t Got That Swing (time mark 0:46)the complete statement of the song is a 32 bar __________ form. Listen to the song below. [song id = 16833083];AA’BA”;
In Hotter Than Hot ( time mark 0:00) which instruments play an 8-bar introduction? Listen to the song below. [song id = 20992410];Clarinet, Trombone, cornet;
The drums at the beginning of Donna Lee take a secondary role in time keeping to which instrument? [song id = 3891521];The bass;
At time mark 0:09 Louis Armstrong plays a melody and improvisation solo through two choruses. Each chorus is how many bars long? Listen to the song below. [song id = 20992410];16;
What is the texture of the Mbire music in the following video <a href='http://www.youtube.com/watch?v=FgFYM_DnSl8&feature=related'>Mbire</a>;Polyphonic;
For what occasion(s) is Mbira music performed?;A, C, and D only;
What was the most significant influence on the development of Western art and music?;Religion;
Which of the following is NOT an instrument of the Javanese gamelan?;Guitar;
How is the Korean kayagum played?;Plucking the strings;
From which instrument(s) does the Mbire music get its sense of rhythm? <a href='http://www.youtube.com/watch?v=FgFYM_DnSl8&feature=related'>Mbire</a>;Shakers;
The Mbira or Lemellophone is an instrument indigenous to what region?;Sub-Saharan Africa;
What is the texture of the music that the Gamelan plays?;Polyphonic;
What term could we use to describe the music of the African Mbira and Javenese gamelan from a Western perspective?;Minimalistic;
What is Ethnomusicology?;A and C only;
How do the Javanese treat the Gamelan?;B and c;
Listen to Arirang, starting at the beginning (time 0:00). Which instrument do you hear playing? [song id = 22336828];Choktae;
What scale is used heavily in Oriental music?;Pentatonic;
What non-Western instrument was introduced to the Western world at the 1889 Exposition Universalle in Paris?;Gamelan;
Which Western composer was particularly fascinated by the Gamelan, and incorporated its texture into his compositions?;Claude Debussy;
The songs of the troubadours, trouveres and minnesingers dealt with what topics?;Courtly love and chivalry;
Gregorian Chant is music;With no set rhythm;
In Josquin’s motet Ave Maria at time mark 4:38, the voice pairings are between which voices? [song id = 9574075];SA and TB;
The troubadours and trouveres of France and minnesingers of Germany performed for which people?;Nobility;
In Hildegard von Bingen’s setting of the Kyrie, the trading off between the soloist and the chorus is called [song id = 2082091];Call and response;
The Renaissance motet is usually ___________ in nature.;Sacred;
Josquin’s frottola, El Grillo, is about what creature?;Cricket;
The first part of Josquin’s motet Ave Maria is in which meter? [song id = 9574075];Duple;
The first polyphony, called organum, began at;Cathedral of Notre Dame in Paris;
As you listen to the "Alleluia Natavitas" by Perotin, the original chant melody is in;The lowest voice;
The lowest voice in the "Alleluia Natavitas" by Perotin;Longer notes than the upper voices;
Gregorian chant is sung;In unison with no harmony;
Identify the texture of the voices at 0:07 in the “Hallelujah Chorus”: [song id = 29009469];Homorhythmic;
Henry Purcell’s only full opera, where every line is sung, is;Dido and Aeneas;
Which composer is known as the “Father of Opera”?;Claudio Monteverdi;
Identify the title and composer from this example:;Requiem Mass by Mozart;
Identify the title and composer from the previous example:. [song id = 11331315];Overture to The Marriage of Figaro by Mozart;
A “Passion” deals with what subject?;Last week of the life of Christ;
Identify this excerpt with the correct title and composer.. [song id = 20737189];Overture from Cadmus et Hermione by Lully;
Identify this excerpt with the correct title and composer.. [song id = 4948419];Dido and Aeneas by Purcell;
Mozart's most famous operas were;Opera buffa;
The term “da capo” means;From the top;
Listen to the following example and identify its form. [song id = 11331315];Sonata-allegro form;
Identify the texture of the voices at 0:49 in the “Hallelujah Chorus”: [song id = 29009469];Polyphonic;
Identify the title and composer from this example:;“Hallelujah Chorus” from Messiah by Handel;
Identify the title and composer from this example:;St. Matthew Passion by Bach;
Identify the title and composer from this aria: [song id = 14376279];“La ci darem la mano” from Don Giovanni by Mozart;
Identify the title and composer from this example: [la-virtuosissima-cantatrice begli-occhi];Begli occhi by Barbara Strozzi;
The form of a da capo aria is;ABA;
What is notable about Elisabeth-Claude Jacquet de la Guerre?;She was the first woman to publish works for keyboard instruments;
During the Baroque Era, for which keyboard instrument(s) did composers write most of their keyboard pieces?;A and D;
What is the main difference between a concerto and a sonata?;A concerto is written solo instrument + orchestra; a sonata is written for solo instrument + piano;
Which is NOT a collection of compositions by J.S. Bach?;The Water Music;
Listen to the Rigaudon from Le tombeau. What is the dynamic of the first few notes? [song id = 9137623];Forte;
Listen to the Ouverture of Handel’s Royal Fireworks Music. What is the tempo of this piece? [song id = 6615980];Slow;
What is unique about Corelli’s Christmas Concerto?;It has 6 movements instead of the usual 3;
Which of the following are vocal/choral genres?;A, B and D only;
Our modern string instruments are modeled after some of those produced during the Baroque Era.;True;
Listen to Couperin’s La Visionaire. How does texture of the composition change at 1:50?;A brief fugue occurs;
Which composer is considered the “father” of both the symphony and the string quartet?;Haydn;
Which of the following is NOT a Baroque-Era composer?;Maurice Ravel;
What is the texture of a fugue?;Polyphonic;
Listen to the Prelude to Le tombeau. Which instrument has the melody at the beginning? [song id = 9137621];Oboe;
What is one reason that instrumental music flourished during the Baroque Era?;Major advances were made in the technology musical instruments (tuning, production, etc.);
Which composer wrote 9 symphonies, and set the standard for symphonic writing from that time forward?;Ludwig van Beethoven;
Again, listen to the Rigaudon from Le tombeau. Which instruments have the melody after the opening notes? [song id = 9137623];Violins (upper strings);
Which composer wrote symphonies that were nicknamed “The Clock,” “London,” and “Surprise”?;Franz Joseph Haydn;
Identify the following listening selection. [song id = 6080000];Vivaldi: Spring from The Four Seasons;
Which was the most prevalent type of solo instrumental work in the Baroque Era?;Sonata;
Which 20th century composer wrote Le tombeau de Couperin, a memorial to French composer Francois Couperin?;Maurice Ravel;
Identify the following listening selection. [song id = 10752004];Bach: Contrapunctus I from The Art of Fugue;
What is the pattern for the tempi in a Classical-Era symphony or string quartet?;Fast – slow – medium (minuet & trio) – fast;
Listen to Bach’s Toccata and Fugue in d minor. How many instruments are playing? [song id = 14968433];1;
Identify the following listening excerpt [song id = 13366447];Schubert: Unfinished Symphony, mvmt. 1;
Chopin had a 10-year affair with George Sand.;True;
Franz Schubert was a contemporary of;Ludwig van Beethoven;
What field was Berlioz’s formal schooling in?;Medicine;
Identify the following listening excerpt [song id = 20728989];Robert Schumann: In the Lovely Month of May;
Mendelssohn staged a concert of the St. Matthew Passion of which composer, (which ignited interest in this composer’s other works)?;Johann Sebastian Bach;
Which term describes a one-movement programmatic symphonic work?;Tone poem;
Composer Frideric Chopin is known for writing music for what instrument?;The piano;
Which young composer was a close family friend of Robert and Clara Schumann?;Johannes Brahms;
Beethoven wrote how many symphonies?;Nine;
Which composer was also a famous concert pianist who had “rock star” status during his lifetime?;Franz Liszt;
Clara Schumann supported herself (and her children) financially by writing musical compositions.;False;
Identify the following listening excerpt [song id = 3390889];Mendelssohn: Midsummer Night’s Dream;
Listen to March to the Scaffold starting at 6:15. What melody do you hear? [song id = 26308579];Idee fixe;
Which of the following composers did NOT live during the Romantic Era?;Giovanni Sammartini;
What is an idee fixe?;A melody that represents a person or feeling;
Why did it take more than 14 years for Brahms to complete his first symphony?;He knew it would be compared to Beethoven’s 9th;
Identify the following listening excerpt [song id = 26308579];Berlioz: Symphonie Fantastique, IV. March to the Scaffold;
What is a leitmotif?;A musical statement that represents a character or a concept;
Who does the idee fixe in Berlioz’s Symphonie Fantastique represent?;Harriet Smithson;
How were Felix Mendelssohn and Wolfgang Amadeus Mozart similar?;A and B only;
Schubert’s symphony that only has two movements instead of the usual four is called;The Unfinished;
After the melody at 6:15 in March to the Scaffold, what can you hear? [song id = 26308579];B and C only;
How did Robert and Clara Schumann meet?;Robert studied piano with her father, Friedrich Wieck;
Identify the following listening excerpt [song id = 21439652];Brahms: Hungarian Dance No. 5;
True or False:  Wagner considered works like The Ring of the Niebelungen to be operas.;False;
Identify the following listening excerpt: [song id = 2698383];Wagner: Ride of the Valkyries;
True or False:  The saying “it’s not over until the fat lady sings” refers to one Brunhilde, a character in one of Wagner’s operas.;True;
True or False:  Bizet died knowing that his last opera was a great success.;False;
Elton John and Tim Rice used the story of which of Verdi’s operas in their Broadway rock opera of the same name?;Aida;
Which vocabulary word refers to the use of pitches that are not in the key of a work?;chromaticism;
Which German opera tells the story of a marksman who gambles his soul to win the girl that he loves?;Der Freischutz;
Georges Bizet is famous today for which acclaimed opera – the story of a free-spirited gypsy girl?;Carmen;
Which of the following was NOT an Italian opera composer from the Romantic Era?;Richard Wagner;
Identify the following listening selection. [song id = 13268801]; Rossini: William Tell Overture;
Which Italian opera composer was nicknamed “the Italian Mozart?”;Gioachino Rossini;
Which of Puccini’s operas tells the story of a Japanese woman whose love is betrayed by her American “husband”?;Madame Butterfly;
Identify the following listening selection. [song id = 16771311];Puccini: Nessun dorma;
Identify the following listening selection. [song id = 12550291];Verdi: La donna e mobile;
Identify the following excerpt [song id = 2441895];Dukas: The Sorcerer's Apprentice;
Which composer wrote the following piece [song id = 2696821];John Philip Sousa;
Which of the following are pieces composed by Nicolai Rimsky-Korsakov?;A and C only;
Which of the following is NOT a composition by Gustav Holst?;The Ring of the Nibelungen;
True or False:  Edvard Grieg’s Piano Concerto in A minor is not often performed today – audiences and pianists do not like it.;False;
Maurice Ravel transcribed which composer’s Pictures at an Exhibition for orchestra?;Modest Musorgsky;
What is nationalistic music?;Music that represents or embodies a specific culture or country;
Identify the following excerpt [song id = 6980254];Gounod: Funeral March of the Marionette;
Identify the following excerpt [song id = 9326960];Vaughan-Williams: Fantasia on a Theme of Thomas Tallis;
Which of the following were important American composers during the late 19th century?;All of the above;
Who were “The Russian Five”?;A group of Russian composers who wanted to create a truly Russian music;
True or False:  Dukas’ The Sorcerer’s Apprentice is featured prominently Disney’s Fantasia.;True;
Identify the following excerpt [song id = 15838687];Rimsky-Korsakov: Flight of the Bumblebee;
Which of the following are compositions by French composer Camille Saint-Saens?;A and B;
Which of the following is NOT true of Tchaikovsky?;All of the above are true of Tchaikovsky;
Why did Bohemian composer Antonin Dvorak come to the United States?;To teach composition at the National Conservatory of Music;
At the beginning of the 20th Century, music divided into 2 large groups.  What were they?;Art Music & Popular Music;
Which of the following were Hungarian composers who could be considered to be the first ethnomusicologists?;Bela Bartok & Zoltan Kodaly;
Identify the following listening excerpt [song id = 26080072];Hindemith: Symphonic Metamorphoses, 4. Marsch;
Identify the following listening excerpt [song id = 3131557];Barber: Adagio for Strings;
Which Brazilian composer became one of the leading Latin American musical figures because he rejected European musical ideas in favor of the music of his own country?;Heitor Villa-Lobos;
Identify the following listening excerpt [song id = 21135903];Gershwin: Summertime from Porgy and Bess;
Identify the following listening excerpt [song id = 11626943];Respighi: The Pines of the Appian Way;
Identify the following listening excerpt [song id = 2103427];Varese: Poeme electronique;
Identify the following listening excerpt [song id = 11095895];Rachmaninoff: Piano Concerto No. 2 in C minor;
Composers Anton Webern, Alban Berg and Arnold Schoenberg were the three members of which group?;The Second Viennese School;
Which American composer was known as a songwriter, and blended jazz and Classical styles in his compositions?;George Gershwin;
Which American composer made a living selling insurance, and won a Pulitzer Prize for his/her 3rd Symphony?;Charles Ives;
Listen to the following composition.  Which instrument is playing? [song id = 6351385];Piano;
Which composer is most closely associated with Impressionism?;Claude Debussy;
Identify the following listening excerpt [song id = 26664423];Berg: Violin Concerto, mvmt. 1;
For which population is 20th Century art music written?;Connoisseurs who understand advanced music structure;
Identify the following listening excerpt [song id = 14376407];Copland: Fanfare for the Common Man;
Identify the following listening excerpt [song id = 21851396];Villa-Lobos: Bachianas Brasileiras, No. 5;
The collaboration of Serge Diaghilev (of The Ballet Russe) and which composer produced ballets like The Firebird, Petrushka, and The Rite of Spring?;Igor Stravinsky;
Identify the following listening excerpt [song id = 6351385];Debussy: Clair de lune;
Which ballet depicts the ritual sacrifice of a maiden, and is famous for causing a riot at its premiere?;The Rite of Spring;
Which of Prokofiev’s compositions tells the story of a young boy and his grandfather, and assigns each character in the story to a specific instrument?;Peter and the Wolf;
Which genre of music was pioneered by Miles Davis, John Coltrane, Thelonius Monk and The Modern Jazz Quartet?;cool jazz ;
Identify the following listening excerpt [song id = 7075855];Foster: Oh, Susanna;
Which of the following are songs written by Stephen Foster?;All of the Above;
True or False:  Songwriter William Billings suffered financially because the U.S. lacked copyright laws that would give him royalties for his songs.;True;
What technique is at the heart of jazz music?;Improvisation;
Bandleader Maynard Ferguson is famous for playing which instrument?;Trumpet;
Which popular music composer wrote The Entertainer?;Scott Joplin;
What is the “strange fruit” in the Billie Holiday blues song with the same name?;Black bodies that had been hung on a tree;
Identify the following listening excerpt [song id = 12208791];Miller: In the Mood;
What is fusion music?;A mix of jazz and other genres;
Why has there been an explosion of popular music in the last 150 years?;Because education of the common people improved&#59; now they have the skills to write down their music;
Identify the following listening excerpt [song id = 2902650];Ellington: It Don’t Mean a Thing if it Ain’t Got That Swing;
What happened to the Big Band after World War II?;All of the above;
What is another name for the Swing Era?;The Big Band Era;
Which of the following is NOT a type of popular music in America today?;Gamelan;
Scott Joplin is associated with which style of American popular music?;Ragtime;
John Philip Sousa is best known for composing what kind of music?;Marches;